{
  "$schema": "http://json-schema.org/draft-07/schema#",
  "$id": "https://aos-data.org/schema/manifestation.schema.json",
  "title": "Manifestation",
  "description": "A manifestation (endless spell) warscroll for Age of Sigmar 4th Edition",
  "type": "object",
  "properties": {
    "$schema": {
      "type": "string"
    },
    "id": {
      "type": "string",
      "pattern": "^[a-z0-9-]+$"
    },
    "name": {
      "type": "string"
    },
    "faction": {
      "type": "string",
      "pattern": "^[a-z0-9-]+$"
    },
    "grandAlliance": {
      "type": "string",
      "enum": [
        "order",
        "chaos",
        "death",
        "destruction"
      ]
    },
    "points": {
      "type": "integer",
      "minimum": 0
    },
    "stats": {
      "type": "object",
      "properties": {
        "move": {
          "type": "string",
          "pattern": "^(-|(\\d*D6(\\+\\d+)?|\\d+)\")$"
        },
        "health": {
          "type": "integer",
          "minimum": 1
        },
        "save": {
          "type": "string"
        },
        "banishment": {
          "type": "integer",
          "minimum": 1
        }
      },
      "required": [
        "move",
        "health",
        "save",
        "banishment"
      ],
      "additionalProperties": false
    },
    "keywords": {
      "type": "array",
      "items": {
        "type": "string"
      }
    },
    "baseSize": {
      "type": "string"
    },
    "costs": {
      "type": "object",
      "properties": {
        "destinyPoints": {
          "type": "integer",
          "minimum": 0
        },
        "ptgCategory": {
          "type": "integer",
          "minimum": 0
        },
        "ghbCategory": {
          "type": "integer",
          "minimum": 0
        }
      },
      "additionalProperties": false
    },
    "publication": {
      "type": "object",
      "properties": {
        "name": {
          "type": "string"
        },
        "shortName": {
          "type": "string"
        },
        "page": {
          "type": "string"
        }
      },
      "required": [
        "name"
      ],
      "additionalProperties": false
    },
    "weapons": {
      "type": "array",
      "items": {
        "type": "object",
        "properties": {
          "name": {
            "type": "string"
          },
          "type": {
            "type": "string",
            "enum": [
              "melee",
              "ranged"
            ]
          },
          "range": {
            "type": "string",
            "pattern": "^\\d+\"$"
          },
          "attacks": {
            "anyOf": [
              {
                "type": "integer",
                "minimum": 1
              },
              {
                "type": "string",
                "pattern": "^\\d?[dD]\\d+.*$"
              }
            ]
          },
          "hit": {
            "type": "string",
            "pattern": "^\\d\\+$"
          },
          "wound": {
            "type": "string",
            "pattern": "^\\d\\+$"
          },
          "rend": {
            "type": "integer",
            "minimum": 0,
            "maximum": 4
          },
          "damage": {
            "anyOf": [
              {
                "type": "integer",
                "minimum": 1
              },
              {
                "type": "string",
                "pattern": "^\\d?[dD]\\d+.*$"
              },
              {
                "type": "string",
                "pattern": "^⟝.*⟞$"
              }
            ]
          },
          "abilities": {
            "type": "array",
            "items": {
              "type": "string"
            }
          }
        },
        "required": [
          "name",
          "type",
          "attacks",
          "hit",
          "wound",
          "rend",
          "damage"
        ],
        "additionalProperties": false
      }
    },
    "abilities": {
      "type": "array",
      "items": {
        "type": "object",
        "properties": {
          "name": {
            "type": "string"
          },
          "type": {
            "type": "string",
            "enum": [
              "passive",
              "reaction",
              "once-per-turn",
              "once-per-battle",
              "spell",
              "prayer",
              "command"
            ]
          },
          "phase": {
            "type": "string",
            "enum": [
              "any",
              "hero",
              "movement",
              "shooting",
              "charge",
              "combat",
              "end"
            ]
          },
          "castingValue": {
            "type": "integer",
            "minimum": 2,
            "maximum": 12
          },
          "chantingValue": {
            "type": "integer",
            "minimum": 2,
            "maximum": 6
          },
          "declare": {
            "type": "string"
          },
          "effect": {
            "type": "string"
          },
          "keywords": {
            "type": "array",
            "items": {
              "type": "string"
            }
          },
          "color": {
            "type": "string",
            "enum": [
              "Black",
              "Blue",
              "Gray",
              "Green",
              "Orange",
              "Purple",
              "Red",
              "Yellow"
            ]
          },
          "abilityCategory": {
            "type": "string",
            "enum": [
              "Offensive",
              "Defensive",
              "Movement",
              "Control",
              "Special",
              "Rallying",
              "Shooting"
            ]
          },
          "modifiers": {
            "type": "array",
            "items": {
              "type": "object",
              "properties": {
                "type": {
                  "type": "string",
                  "enum": [
                    "set",
                    "increment",
                    "decrement",
                    "append",
                    "add",
                    "remove"
                  ]
                },
                "field": {
                  "type": "string"
                },
                "value": {
                  "type": "string"
                },
                "conditions": {
                  "type": "object",
                  "properties": {
                    "logic": {
                      "type": "string",
                      "enum": [
                        "and",
                        "or"
                      ]
                    },
                    "conditions": {
                      "type": "array",
                      "items": {
                        "type": "object",
                        "properties": {
                          "type": {
                            "type": "string",
                            "enum": [
                              "equalTo",
                              "notEqualTo",
                              "lessThan",
                              "greaterThan",
                              "atLeast",
                              "atMost",
                              "instanceOf"
                            ]
                          },
                          "value": {
                            "type": "string"
                          },
                          "field": {
                            "type": "string"
                          },
                          "scope": {
                            "type": "string"
                          },
                          "childId": {
                            "type": "string"
                          }
                        },
                        "required": [
                          "type",
                          "value",
                          "field"
                        ],
                        "additionalProperties": false
                      }
                    },
                    "groups": {
                      "type": "array",
                      "items": {}
                    }
                  },
                  "required": [
                    "logic"
                  ],
                  "additionalProperties": false
                }
              },
              "required": [
                "type",
                "field",
                "value"
              ],
              "additionalProperties": false
            }
          }
        },
        "required": [
          "name",
          "type",
          "effect"
        ],
        "additionalProperties": false
      }
    },
    "_meta": {
      "type": "object",
      "properties": {
        "lastUpdated": {
          "type": "string"
        },
        "source": {
          "type": "string"
        }
      },
      "additionalProperties": false
    }
  },
  "required": [
    "id",
    "name",
    "faction",
    "points",
    "stats",
    "keywords"
  ],
  "additionalProperties": false
}
