{
  "$schema": "https://aos-data.org/schema/manifestation.schema.json",
  "id": "heart-of-fury",
  "name": "Heart of Fury",
  "faction": "daughters-of-khaine",
  "points": 0,
  "stats": {
    "move": "-",
    "health": 7,
    "save": "4+",
    "banishment": 7
  },
  "keywords": [
    "DAUGHTERS OF KHAINE",
    "INVOCATION",
    "MANIFESTATION",
    "ORDER",
    "WARD (6+)"
  ],
  "_meta": {
    "lastUpdated": "2026-01-07",
    "source": "BSData import"
  },
  "grandAlliance": "order",
  "baseSize": "50mm",
  "abilities": [
    {
      "name": "Locus of the Murder God",
      "type": "passive",
      "effect": "Subtract 1 from wound rolls for combat attacks that target friendly **^^Daughters of Khaine Infantry^^** units while they are wholly within 12\" of this **^^Manifestation^^**.",
      "color": "Green",
      "abilityCategory": "Defensive"
    }
  ]
}
