{
  "$schema": "https://aos-data.org/schema/manifestation.schema.json",
  "id": "malevolent-moon",
  "name": "Malevolent Moon",
  "faction": "gloomspite-gitz",
  "points": 0,
  "stats": {
    "move": "12\"",
    "health": 6,
    "save": "6+",
    "banishment": 7
  },
  "keywords": [
    "DESTRUCTION",
    "ENDLESS SPELL",
    "FLY",
    "GLOOMSPITE GITZ",
    "MANIFESTATION",
    "WARD (6+)"
  ],
  "_meta": {
    "lastUpdated": "2026-01-06",
    "source": "BSData import"
  },
  "grandAlliance": "destruction",
  "publication": {
    "name": "Battletome: Gloomspite Gitz"
  },
  "baseSize": "50mm",
  "weapons": [
    {
      "name": "Lunarock Slam",
      "type": "melee",
      "attacks": 1,
      "hit": "4+",
      "wound": "4+",
      "rend": 0,
      "damage": 1
    }
  ],
  "abilities": [
    {
      "name": "Lurid Light",
      "type": "passive",
      "effect": "While friendly **^^Gloomspite Gitz^^** units are wholly within 12\" of this **^^Manifestation^^** they are affected by all four faces of the Bad Moon (Grinnin', Scowlin', Sulkin', and Cacklin').",
      "color": "Black",
      "abilityCategory": "Special"
    }
  ]
}
